{
  "schema": "kadoka.inference.response/1",
  "request_id": "req-000001",
  "status": "success",
  "operation": "decision",
  "provider": {
    "provider_id": "kadoka.local.llamacpp",
    "provider_version": "0.1.0",
    "protocol_version": 1,
    "model_id": "standard-small",
    "model_revision": null
  },
  "result": {
    "selected_action_id": "move-left",
    "confidence": 0.74,
    "reason": "The candidate is valid and consistent with the current goal."
  },
  "usage": {
    "input_tokens": 412,
    "output_tokens": 31,
    "total_tokens": 443
  },
  "timing": {
    "queue_ms": 0.3,
    "inference_ms": 87.4,
    "total_ms": 89.1
  }
}
